{
  "access": {
    "mode": "public_read_only",
    "prohibited_scopes": [
      "account",
      "assets",
      "cash",
      "holdings",
      "orders",
      "positions",
      "portfolio",
      "trades"
    ],
    "query_args": {
      "countries": [
        "GBR"
      ],
      "date": "2021:2023",
      "format": "json",
      "indicator": "FP.CPI.TOTL",
      "per_page": 1000,
      "source": 2
    },
    "query_name": "World Bank Indicators API v2"
  },
  "contract_type": "data_snapshot",
  "contract_version": "1.0.0",
  "financial_subject": {
    "currency": {
      "code": "USD"
    },
    "entity_name": "GBR — Consumer price index (2010 = 100)",
    "identifiers": [
      {
        "scheme": "WB_COUNTRY",
        "value": "GBR"
      },
      {
        "scheme": "WB_INDICATOR",
        "value": "FP.CPI.TOTL"
      }
    ],
    "market": {
      "country": "GBR",
      "mic": "XXXX",
      "timezone": "UTC"
    },
    "subject_type": "macro_series",
    "units": {
      "accounting_basis": "World Development Indicators; indicator-specific unit is preserved in each record",
      "amount_scale": "unit",
      "price_basis": "not_applicable"
    }
  },
  "integrity": {
    "canonicalization": "financial-agent-c14n-json-v1",
    "content_sha256": "330611c845906cbf30ab46fdef54a843ca43bb4c2e8d2a64ac2e365edab6ec33",
    "hash_algorithm": "sha256"
  },
  "lineage": {
    "code_revision": "2f0751ef1865b2617913bbcac414392e759945bec0fec01604a8bf8d349177de",
    "collector": "cases/public/build_public_cases.py:fetch_raw",
    "collector_version": "1.0.0",
    "parent_snapshot_ids": [],
    "query_args": {
      "request_urls": [
        "https://api.worldbank.org/v2/country/GBR/indicator/FP.CPI.TOTL?date=2021%3A2023&format=json&per_page=1000&source=2"
      ]
    },
    "raw_response_sha256": "eb3fcf8b87f6991b04d680be0a9a2c432fc55cdde6f20db467425b6f0685b05e",
    "schema_version": "case-data/1.0.0"
  },
  "records": [
    {
      "evidence_type": "wdi_indicator_observation",
      "payload": {
        "country_code": "GBR",
        "country_name": "United Kingdom",
        "decimal_hint": "1",
        "indicator_code": "FP.CPI.TOTL",
        "indicator_name": "Consumer price index (2010 = 100)",
        "observation_status": "",
        "unit": "indicator-defined; see WDI metadata",
        "value": "123.848714629184",
        "year": "2021"
      },
      "record_id": "FKW-05-GBR-2021",
      "source_locator": "snapshots/public/raw/FKW-05.json#/responses/0/1/0"
    },
    {
      "evidence_type": "wdi_indicator_observation",
      "payload": {
        "country_code": "GBR",
        "country_name": "United Kingdom",
        "decimal_hint": "1",
        "indicator_code": "FP.CPI.TOTL",
        "indicator_name": "Consumer price index (2010 = 100)",
        "observation_status": "",
        "unit": "indicator-defined; see WDI metadata",
        "value": "133.660070279268",
        "year": "2022"
      },
      "record_id": "FKW-05-GBR-2022",
      "source_locator": "snapshots/public/raw/FKW-05.json#/responses/0/1/1"
    },
    {
      "evidence_type": "wdi_indicator_observation",
      "payload": {
        "country_code": "GBR",
        "country_name": "United Kingdom",
        "decimal_hint": "1",
        "indicator_code": "FP.CPI.TOTL",
        "indicator_name": "Consumer price index (2010 = 100)",
        "observation_status": "",
        "unit": "indicator-defined; see WDI metadata",
        "value": "142.740891437026",
        "year": "2023"
      },
      "record_id": "FKW-05-GBR-2023",
      "source_locator": "snapshots/public/raw/FKW-05.json#/responses/0/1/2"
    }
  ],
  "revision": 1,
  "snapshot_id": "snapshot-public-fkw-05-wdi-2021-2023-v1",
  "source": {
    "dataset": "World Development Indicators source=2; API lastupdated=2026-07-13",
    "license": {
      "name": "Creative Commons Attribution 4.0",
      "redistributable": true,
      "url": "https://datacatalog.worldbank.org/search/dataset/0037712/world-development-indicators"
    },
    "provider": "world_bank",
    "source_type": "macro",
    "uri": "https://api.worldbank.org/v2/country/GBR/indicator/FP.CPI.TOTL?date=2021%3A2023&format=json&per_page=1000&source=2"
  },
  "status": "frozen",
  "temporal": {
    "as_of": "2026-08-11T02:00:00Z",
    "available_at": "2026-08-11T02:00:00Z",
    "event_time": "2023-12-31T23:59:59Z",
    "retrieved_at": "2026-08-11T02:00:00Z"
  }
}
