{
  "access": {
    "mode": "public_read_only",
    "prohibited_scopes": [
      "account",
      "assets",
      "cash",
      "holdings",
      "orders",
      "positions",
      "portfolio",
      "trades"
    ],
    "query_args": {
      "countries": [
        "ZAF"
      ],
      "date": "2021:2023",
      "format": "json",
      "indicator": "NY.GDP.PCAP.CD",
      "per_page": 1000,
      "source": 2
    },
    "query_name": "World Bank Indicators API v2"
  },
  "contract_type": "data_snapshot",
  "contract_version": "1.0.0",
  "financial_subject": {
    "currency": {
      "code": "USD"
    },
    "entity_name": "ZAF — GDP per capita (current US$)",
    "identifiers": [
      {
        "scheme": "WB_COUNTRY",
        "value": "ZAF"
      },
      {
        "scheme": "WB_INDICATOR",
        "value": "NY.GDP.PCAP.CD"
      }
    ],
    "market": {
      "country": "ZAF",
      "mic": "XXXX",
      "timezone": "UTC"
    },
    "subject_type": "macro_series",
    "units": {
      "accounting_basis": "World Development Indicators; indicator-specific unit is preserved in each record",
      "amount_scale": "unit",
      "price_basis": "not_applicable"
    }
  },
  "integrity": {
    "canonicalization": "financial-agent-c14n-json-v1",
    "content_sha256": "b5c5017790ef4389696b152d945e0d48cf0ae6236e654e178dcd71c2fb7da09a",
    "hash_algorithm": "sha256"
  },
  "lineage": {
    "code_revision": "2f0751ef1865b2617913bbcac414392e759945bec0fec01604a8bf8d349177de",
    "collector": "cases/public/build_public_cases.py:fetch_raw",
    "collector_version": "1.0.0",
    "parent_snapshot_ids": [],
    "query_args": {
      "request_urls": [
        "https://api.worldbank.org/v2/country/ZAF/indicator/NY.GDP.PCAP.CD?date=2021%3A2023&format=json&per_page=1000&source=2"
      ]
    },
    "raw_response_sha256": "8ded214c13057b8fac1c3016233c236663865c1f07d45f8ed1acfe9946be978c",
    "schema_version": "case-data/1.0.0"
  },
  "records": [
    {
      "evidence_type": "wdi_indicator_observation",
      "payload": {
        "country_code": "ZAF",
        "country_name": "South Africa",
        "decimal_hint": "1",
        "indicator_code": "NY.GDP.PCAP.CD",
        "indicator_name": "GDP per capita (current US$)",
        "observation_status": "",
        "unit": "indicator-defined; see WDI metadata",
        "value": "6828.75624590017",
        "year": "2021"
      },
      "record_id": "FKW-11-ZAF-2021",
      "source_locator": "snapshots/public/raw/FKW-11.json#/responses/0/1/0"
    },
    {
      "evidence_type": "wdi_indicator_observation",
      "payload": {
        "country_code": "ZAF",
        "country_name": "South Africa",
        "decimal_hint": "1",
        "indicator_code": "NY.GDP.PCAP.CD",
        "indicator_name": "GDP per capita (current US$)",
        "observation_status": "",
        "unit": "indicator-defined; see WDI metadata",
        "value": "6534.24867783397",
        "year": "2022"
      },
      "record_id": "FKW-11-ZAF-2022",
      "source_locator": "snapshots/public/raw/FKW-11.json#/responses/0/1/1"
    },
    {
      "evidence_type": "wdi_indicator_observation",
      "payload": {
        "country_code": "ZAF",
        "country_name": "South Africa",
        "decimal_hint": "1",
        "indicator_code": "NY.GDP.PCAP.CD",
        "indicator_name": "GDP per capita (current US$)",
        "observation_status": "",
        "unit": "indicator-defined; see WDI metadata",
        "value": "6034.27208964673",
        "year": "2023"
      },
      "record_id": "FKW-11-ZAF-2023",
      "source_locator": "snapshots/public/raw/FKW-11.json#/responses/0/1/2"
    }
  ],
  "revision": 1,
  "snapshot_id": "snapshot-public-fkw-11-wdi-2021-2023-v1",
  "source": {
    "dataset": "World Development Indicators source=2; API lastupdated=2026-07-13",
    "license": {
      "name": "Creative Commons Attribution 4.0",
      "redistributable": true,
      "url": "https://datacatalog.worldbank.org/search/dataset/0037712/world-development-indicators"
    },
    "provider": "world_bank",
    "source_type": "macro",
    "uri": "https://api.worldbank.org/v2/country/ZAF/indicator/NY.GDP.PCAP.CD?date=2021%3A2023&format=json&per_page=1000&source=2"
  },
  "status": "frozen",
  "temporal": {
    "as_of": "2026-08-11T02:00:00Z",
    "available_at": "2026-08-11T02:00:00Z",
    "event_time": "2023-12-31T23:59:59Z",
    "retrieved_at": "2026-08-11T02:00:00Z"
  }
}
